No.     Time           Source                Destination           Protocol Length Info
    177 2.924778       192.168.118.27        128.119.245.12        HTTP     586    GET /wireshark-labs/HTTP-wireshark-file4.html HTTP/1.1 

Frame 177: 586 bytes on wire (4688 bits), 586 bytes captured (4688 bits) on interface 0
    Interface id: 0 (\Device\NPF_{4BA3A7C4-3CE9-4764-8191-DE5C0331710F})
        Interface name: \Device\NPF_{4BA3A7C4-3CE9-4764-8191-DE5C0331710F}
        Interface description: \320\221\320\265\321\201\320\277\321\200\320\276\320\262\320\276\320\264\320\275\320\260\321\217 \321\201\320\265\321\202\321\214
    Encapsulation type: Ethernet (1)
    Arrival Time: Oct 19, 2019 12:06:59.892304000 RTZ 2 (зима)
    [Time shift for this packet: 0.000000000 seconds]
    Epoch Time: 1571476019.892304000 seconds
    [Time delta from previous captured frame: 0.000405000 seconds]
    [Time delta from previous displayed frame: 0.000000000 seconds]
    [Time since reference or first frame: 2.924778000 seconds]
    Frame Number: 177
    Frame Length: 586 bytes (4688 bits)
    Capture Length: 586 bytes (4688 bits)
    [Frame is marked: False]
    [Frame is ignored: False]
    [Protocols in frame: eth:ethertype:ip:tcp:http]
    [Coloring Rule Name: HTTP]
    [Coloring Rule String: http || tcp.port == 80 || http2]
Ethernet II, Src: HonHaiPr_30:98:8d (54:35:30:30:98:8d), Dst: AsustekC_67:19:61 (00:18:f3:67:19:61)
    Destination: AsustekC_67:19:61 (00:18:f3:67:19:61)
        Address: AsustekC_67:19:61 (00:18:f3:67:19:61)
        .... ..0. .... .... .... .... = LG bit: Globally unique address (factory default)
        .... ...0 .... .... .... .... = IG bit: Individual address (unicast)
    Source: HonHaiPr_30:98:8d (54:35:30:30:98:8d)
        Address: HonHaiPr_30:98:8d (54:35:30:30:98:8d)
        .... ..0. .... .... .... .... = LG bit: Globally unique address (factory default)
        .... ...0 .... .... .... .... = IG bit: Individual address (unicast)
    Type: IPv4 (0x0800)
Internet Protocol Version 4, Src: 192.168.118.27, Dst: 128.119.245.12
    0100 .... = Version: 4
    .... 0101 = Header Length: 20 bytes (5)
    Differentiated Services Field: 0x00 (DSCP: CS0, ECN: Not-ECT)
        0000 00.. = Differentiated Services Codepoint: Default (0)
        .... ..00 = Explicit Congestion Notification: Not ECN-Capable Transport (0)
    Total Length: 572
    Identification: 0xb729 (46889)
    Flags: 0x4000, Don't fragment
        0... .... .... .... = Reserved bit: Not set
        .1.. .... .... .... = Don't fragment: Set
        ..0. .... .... .... = More fragments: Not set
        ...0 0000 0000 0000 = Fragment offset: 0
    Time to live: 128
    Protocol: TCP (6)
    Header checksum: 0x954a [validation disabled]
    [Header checksum status: Unverified]
    Source: 192.168.118.27
    Destination: 128.119.245.12
Transmission Control Protocol, Src Port: 58794, Dst Port: 80, Seq: 1, Ack: 1, Len: 532
    Source Port: 58794
    Destination Port: 80
    [Stream index: 11]
    [TCP Segment Len: 532]
    Sequence number: 1    (relative sequence number)
    [Next sequence number: 533    (relative sequence number)]
    Acknowledgment number: 1    (relative ack number)
    0101 .... = Header Length: 20 bytes (5)
    Flags: 0x018 (PSH, ACK)
        000. .... .... = Reserved: Not set
        ...0 .... .... = Nonce: Not set
        .... 0... .... = Congestion Window Reduced (CWR): Not set
        .... .0.. .... = ECN-Echo: Not set
        .... ..0. .... = Urgent: Not set
        .... ...1 .... = Acknowledgment: Set
        .... .... 1... = Push: Set
        .... .... .0.. = Reset: Not set
        .... .... ..0. = Syn: Not set
        .... .... ...0 = Fin: Not set
        [TCP Flags: ·······AP···]
    Window size value: 513
    [Calculated window size: 131328]
    [Window size scaling factor: 256]
    Checksum: 0xdef8 [unverified]
    [Checksum Status: Unverified]
    Urgent pointer: 0
    [SEQ/ACK analysis]
        [iRTT: 0.125307000 seconds]
        [Bytes in flight: 532]
        [Bytes sent since last PSH flag: 532]
    [Timestamps]
        [Time since first frame in this TCP stream: 0.125926000 seconds]
        [Time since previous frame in this TCP stream: 0.000619000 seconds]
    TCP payload (532 bytes)
Hypertext Transfer Protocol
    GET /wireshark-labs/HTTP-wireshark-file4.html HTTP/1.1\r\n
        [Expert Info (Chat/Sequence): GET /wireshark-labs/HTTP-wireshark-file4.html HTTP/1.1\r\n]
        Request Method: GET
        Request URI: /wireshark-labs/HTTP-wireshark-file4.html
        Request Version: HTTP/1.1
    Host: gaia.cs.umass.edu\r\n
    Connection: keep-alive\r\n
    Pragma: no-cache\r\n
    Cache-Control: no-cache\r\n
    Upgrade-Insecure-Requests: 1\r\n
    User-Agent: Mozilla/5.0 (Windows NT 10.0; Win64; x64) AppleWebKit/537.36 (KHTML, like Gecko) Chrome/77.0.3865.120 Safari/537.36\r\n
    Accept: text/html,application/xhtml+xml,application/xml;q=0.9,image/webp,image/apng,*/*;q=0.8,application/signed-exchange;v=b3\r\n
    Accept-Encoding: gzip, deflate\r\n
    Accept-Language: uk-UA,uk;q=0.9,ru;q=0.8,en-US;q=0.7,en;q=0.6\r\n
    \r\n
    [Full request URI: http://gaia.cs.umass.edu/wireshark-labs/HTTP-wireshark-file4.html]
    [HTTP request 1/3]
    [Response in frame: 189]
    [Next request in frame: 191]

No.     Time           Source                Destination           Protocol Length Info
    189 3.180856       128.119.245.12        192.168.118.27        HTTP     1127   HTTP/1.1 200 OK  (text/html)

Frame 189: 1127 bytes on wire (9016 bits), 1127 bytes captured (9016 bits) on interface 0
    Interface id: 0 (\Device\NPF_{4BA3A7C4-3CE9-4764-8191-DE5C0331710F})
        Interface name: \Device\NPF_{4BA3A7C4-3CE9-4764-8191-DE5C0331710F}
        Interface description: \320\221\320\265\321\201\320\277\321\200\320\276\320\262\320\276\320\264\320\275\320\260\321\217 \321\201\320\265\321\202\321\214
    Encapsulation type: Ethernet (1)
    Arrival Time: Oct 19, 2019 12:07:00.148382000 RTZ 2 (зима)
    [Time shift for this packet: 0.000000000 seconds]
    Epoch Time: 1571476020.148382000 seconds
    [Time delta from previous captured frame: 0.006409000 seconds]
    [Time delta from previous displayed frame: 0.256078000 seconds]
    [Time since reference or first frame: 3.180856000 seconds]
    Frame Number: 189
    Frame Length: 1127 bytes (9016 bits)
    Capture Length: 1127 bytes (9016 bits)
    [Frame is marked: False]
    [Frame is ignored: False]
    [Protocols in frame: eth:ethertype:ip:tcp:http:data-text-lines]
    [Coloring Rule Name: HTTP]
    [Coloring Rule String: http || tcp.port == 80 || http2]
Ethernet II, Src: AsustekC_67:19:61 (00:18:f3:67:19:61), Dst: HonHaiPr_30:98:8d (54:35:30:30:98:8d)
    Destination: HonHaiPr_30:98:8d (54:35:30:30:98:8d)
        Address: HonHaiPr_30:98:8d (54:35:30:30:98:8d)
        .... ..0. .... .... .... .... = LG bit: Globally unique address (factory default)
        .... ...0 .... .... .... .... = IG bit: Individual address (unicast)
    Source: AsustekC_67:19:61 (00:18:f3:67:19:61)
        Address: AsustekC_67:19:61 (00:18:f3:67:19:61)
        .... ..0. .... .... .... .... = LG bit: Globally unique address (factory default)
        .... ...0 .... .... .... .... = IG bit: Individual address (unicast)
    Type: IPv4 (0x0800)
Internet Protocol Version 4, Src: 128.119.245.12, Dst: 192.168.118.27
    0100 .... = Version: 4
    .... 0101 = Header Length: 20 bytes (5)
    Differentiated Services Field: 0x00 (DSCP: CS0, ECN: Not-ECT)
        0000 00.. = Differentiated Services Codepoint: Default (0)
        .... ..00 = Explicit Congestion Notification: Not ECN-Capable Transport (0)
    Total Length: 1113
    Identification: 0x310e (12558)
    Flags: 0x4000, Don't fragment
        0... .... .... .... = Reserved bit: Not set
        .1.. .... .... .... = Don't fragment: Set
        ..0. .... .... .... = More fragments: Not set
        ...0 0000 0000 0000 = Fragment offset: 0
    Time to live: 48
    Protocol: TCP (6)
    Header checksum: 0x6949 [validation disabled]
    [Header checksum status: Unverified]
    Source: 128.119.245.12
    Destination: 192.168.118.27
Transmission Control Protocol, Src Port: 80, Dst Port: 58794, Seq: 1, Ack: 533, Len: 1073
    Source Port: 80
    Destination Port: 58794
    [Stream index: 11]
    [TCP Segment Len: 1073]
    Sequence number: 1    (relative sequence number)
    [Next sequence number: 1074    (relative sequence number)]
    Acknowledgment number: 533    (relative ack number)
    0101 .... = Header Length: 20 bytes (5)
    Flags: 0x018 (PSH, ACK)
        000. .... .... = Reserved: Not set
        ...0 .... .... = Nonce: Not set
        .... 0... .... = Congestion Window Reduced (CWR): Not set
        .... .0.. .... = ECN-Echo: Not set
        .... ..0. .... = Urgent: Not set
        .... ...1 .... = Acknowledgment: Set
        .... .... 1... = Push: Set
        .... .... .0.. = Reset: Not set
        .... .... ..0. = Syn: Not set
        .... .... ...0 = Fin: Not set
        [TCP Flags: ·······AP···]
    Window size value: 237
    [Calculated window size: 30336]
    [Window size scaling factor: 128]
    Checksum: 0xe8ea [unverified]
    [Checksum Status: Unverified]
    Urgent pointer: 0
    [SEQ/ACK analysis]
        [iRTT: 0.125307000 seconds]
        [Bytes in flight: 1073]
        [Bytes sent since last PSH flag: 1073]
    [Timestamps]
        [Time since first frame in this TCP stream: 0.382004000 seconds]
        [Time since previous frame in this TCP stream: 0.006409000 seconds]
    TCP payload (1073 bytes)
Hypertext Transfer Protocol
    HTTP/1.1 200 OK\r\n
        [Expert Info (Chat/Sequence): HTTP/1.1 200 OK\r\n]
        Response Version: HTTP/1.1
        Status Code: 200
        [Status Code Description: OK]
        Response Phrase: OK
    Date: Sat, 19 Oct 2019 09:07:01 GMT\r\n
    Server: Apache/2.4.6 (CentOS) OpenSSL/1.0.2k-fips PHP/5.4.16 mod_perl/2.0.10 Perl/v5.16.3\r\n
    Last-Modified: Sat, 19 Oct 2019 05:59:03 GMT\r\n
    ETag: "2ca-5953d25d1970b"\r\n
    Accept-Ranges: bytes\r\n
    Content-Length: 714\r\n
        [Content length: 714]
    Keep-Alive: timeout=5, max=100\r\n
    Connection: Keep-Alive\r\n
    Content-Type: text/html; charset=UTF-8\r\n
    \r\n
    [HTTP response 1/3]
    [Time since request: 0.256078000 seconds]
    [Request in frame: 177]
    [Next request in frame: 191]
    [Next response in frame: 200]
    [Request URI: http://gaia.cs.umass.edu/wireshark-labs/HTTP-wireshark-file4.html]
    File Data: 714 bytes
Line-based text data: text/html (17 lines)
    <html>\n
    <head>\n
    <title>Lab2-4 file: Embedded URLs</title>\n
    <meta http-equiv="Content-Type" content="text/html; charset=iso-8859-1">\n
    </head>\n
    \n
    <body bgcolor="#FFFFFF" text="#000000">\n
    \n
    <p>\n
    <img src="http://gaia.cs.umass.edu/pearson.png" WIDTH="70" HEIGHT="41" > </p>\n
    <p>This little HTML file is being served by gaia.cs.umass.edu. \n
    It contains two embedded images. <br> The image above, also served from the \n
    gaia.cs.umass.edu web site, is the logo of our publisher, Pearson. <br>\n
    The image of our 5th edition book cover below is stored at, and served from, the www server caite.cs.umass.edu:</p>\n
    <p align="left"><img src="http://manic.cs.umass.edu/~kurose/cover_5th_ed.jpg" width="168" height="220"></p>\n
    </body>\n
    </html>\n

No.     Time           Source                Destination           Protocol Length Info
    191 3.234375       192.168.118.27        128.119.245.12        HTTP     524    GET /pearson.png HTTP/1.1 

Frame 191: 524 bytes on wire (4192 bits), 524 bytes captured (4192 bits) on interface 0
    Interface id: 0 (\Device\NPF_{4BA3A7C4-3CE9-4764-8191-DE5C0331710F})
        Interface name: \Device\NPF_{4BA3A7C4-3CE9-4764-8191-DE5C0331710F}
        Interface description: \320\221\320\265\321\201\320\277\321\200\320\276\320\262\320\276\320\264\320\275\320\260\321\217 \321\201\320\265\321\202\321\214
    Encapsulation type: Ethernet (1)
    Arrival Time: Oct 19, 2019 12:07:00.201901000 RTZ 2 (зима)
    [Time shift for this packet: 0.000000000 seconds]
    Epoch Time: 1571476020.201901000 seconds
    [Time delta from previous captured frame: 0.012290000 seconds]
    [Time delta from previous displayed frame: 0.053519000 seconds]
    [Time since reference or first frame: 3.234375000 seconds]
    Frame Number: 191
    Frame Length: 524 bytes (4192 bits)
    Capture Length: 524 bytes (4192 bits)
    [Frame is marked: False]
    [Frame is ignored: False]
    [Protocols in frame: eth:ethertype:ip:tcp:http]
    [Coloring Rule Name: HTTP]
    [Coloring Rule String: http || tcp.port == 80 || http2]
Ethernet II, Src: HonHaiPr_30:98:8d (54:35:30:30:98:8d), Dst: AsustekC_67:19:61 (00:18:f3:67:19:61)
    Destination: AsustekC_67:19:61 (00:18:f3:67:19:61)
        Address: AsustekC_67:19:61 (00:18:f3:67:19:61)
        .... ..0. .... .... .... .... = LG bit: Globally unique address (factory default)
        .... ...0 .... .... .... .... = IG bit: Individual address (unicast)
    Source: HonHaiPr_30:98:8d (54:35:30:30:98:8d)
        Address: HonHaiPr_30:98:8d (54:35:30:30:98:8d)
        .... ..0. .... .... .... .... = LG bit: Globally unique address (factory default)
        .... ...0 .... .... .... .... = IG bit: Individual address (unicast)
    Type: IPv4 (0x0800)
Internet Protocol Version 4, Src: 192.168.118.27, Dst: 128.119.245.12
    0100 .... = Version: 4
    .... 0101 = Header Length: 20 bytes (5)
    Differentiated Services Field: 0x00 (DSCP: CS0, ECN: Not-ECT)
        0000 00.. = Differentiated Services Codepoint: Default (0)
        .... ..00 = Explicit Congestion Notification: Not ECN-Capable Transport (0)
    Total Length: 510
    Identification: 0xb72b (46891)
    Flags: 0x4000, Don't fragment
        0... .... .... .... = Reserved bit: Not set
        .1.. .... .... .... = Don't fragment: Set
        ..0. .... .... .... = More fragments: Not set
        ...0 0000 0000 0000 = Fragment offset: 0
    Time to live: 128
    Protocol: TCP (6)
    Header checksum: 0x9586 [validation disabled]
    [Header checksum status: Unverified]
    Source: 192.168.118.27
    Destination: 128.119.245.12
Transmission Control Protocol, Src Port: 58794, Dst Port: 80, Seq: 533, Ack: 1074, Len: 470
    Source Port: 58794
    Destination Port: 80
    [Stream index: 11]
    [TCP Segment Len: 470]
    Sequence number: 533    (relative sequence number)
    [Next sequence number: 1003    (relative sequence number)]
    Acknowledgment number: 1074    (relative ack number)
    0101 .... = Header Length: 20 bytes (5)
    Flags: 0x018 (PSH, ACK)
        000. .... .... = Reserved: Not set
        ...0 .... .... = Nonce: Not set
        .... 0... .... = Congestion Window Reduced (CWR): Not set
        .... .0.. .... = ECN-Echo: Not set
        .... ..0. .... = Urgent: Not set
        .... ...1 .... = Acknowledgment: Set
        .... .... 1... = Push: Set
        .... .... .0.. = Reset: Not set
        .... .... ..0. = Syn: Not set
        .... .... ...0 = Fin: Not set
        [TCP Flags: ·······AP···]
    Window size value: 509
    [Calculated window size: 130304]
    [Window size scaling factor: 256]
    Checksum: 0xf3ca [unverified]
    [Checksum Status: Unverified]
    Urgent pointer: 0
    [SEQ/ACK analysis]
        [iRTT: 0.125307000 seconds]
        [Bytes in flight: 470]
        [Bytes sent since last PSH flag: 470]
    [Timestamps]
        [Time since first frame in this TCP stream: 0.435523000 seconds]
        [Time since previous frame in this TCP stream: 0.012290000 seconds]
    TCP payload (470 bytes)
Hypertext Transfer Protocol
    GET /pearson.png HTTP/1.1\r\n
        [Expert Info (Chat/Sequence): GET /pearson.png HTTP/1.1\r\n]
        Request Method: GET
        Request URI: /pearson.png
        Request Version: HTTP/1.1
    Host: gaia.cs.umass.edu\r\n
    Connection: keep-alive\r\n
    Pragma: no-cache\r\n
    Cache-Control: no-cache\r\n
    User-Agent: Mozilla/5.0 (Windows NT 10.0; Win64; x64) AppleWebKit/537.36 (KHTML, like Gecko) Chrome/77.0.3865.120 Safari/537.36\r\n
    Accept: image/webp,image/apng,image/*,*/*;q=0.8\r\n
    Referer: http://gaia.cs.umass.edu/wireshark-labs/HTTP-wireshark-file4.html\r\n
    Accept-Encoding: gzip, deflate\r\n
    Accept-Language: uk-UA,uk;q=0.9,ru;q=0.8,en-US;q=0.7,en;q=0.6\r\n
    \r\n
    [Full request URI: http://gaia.cs.umass.edu/pearson.png]
    [HTTP request 2/3]
    [Prev request in frame: 177]
    [Response in frame: 200]
    [Next request in frame: 314]

No.     Time           Source                Destination           Protocol Length Info
    196 3.358301       192.168.118.27        128.119.245.12        HTTP     538    GET /~kurose/cover_5th_ed.jpg HTTP/1.1 

Frame 196: 538 bytes on wire (4304 bits), 538 bytes captured (4304 bits) on interface 0
    Interface id: 0 (\Device\NPF_{4BA3A7C4-3CE9-4764-8191-DE5C0331710F})
        Interface name: \Device\NPF_{4BA3A7C4-3CE9-4764-8191-DE5C0331710F}
        Interface description: \320\221\320\265\321\201\320\277\321\200\320\276\320\262\320\276\320\264\320\275\320\260\321\217 \321\201\320\265\321\202\321\214
    Encapsulation type: Ethernet (1)
    Arrival Time: Oct 19, 2019 12:07:00.325827000 RTZ 2 (зима)
    [Time shift for this packet: 0.000000000 seconds]
    Epoch Time: 1571476020.325827000 seconds
    [Time delta from previous captured frame: 0.000296000 seconds]
    [Time delta from previous displayed frame: 0.123926000 seconds]
    [Time since reference or first frame: 3.358301000 seconds]
    Frame Number: 196
    Frame Length: 538 bytes (4304 bits)
    Capture Length: 538 bytes (4304 bits)
    [Frame is marked: False]
    [Frame is ignored: False]
    [Protocols in frame: eth:ethertype:ip:tcp:http]
    [Coloring Rule Name: HTTP]
    [Coloring Rule String: http || tcp.port == 80 || http2]
Ethernet II, Src: HonHaiPr_30:98:8d (54:35:30:30:98:8d), Dst: AsustekC_67:19:61 (00:18:f3:67:19:61)
    Destination: AsustekC_67:19:61 (00:18:f3:67:19:61)
        Address: AsustekC_67:19:61 (00:18:f3:67:19:61)
        .... ..0. .... .... .... .... = LG bit: Globally unique address (factory default)
        .... ...0 .... .... .... .... = IG bit: Individual address (unicast)
    Source: HonHaiPr_30:98:8d (54:35:30:30:98:8d)
        Address: HonHaiPr_30:98:8d (54:35:30:30:98:8d)
        .... ..0. .... .... .... .... = LG bit: Globally unique address (factory default)
        .... ...0 .... .... .... .... = IG bit: Individual address (unicast)
    Type: IPv4 (0x0800)
Internet Protocol Version 4, Src: 192.168.118.27, Dst: 128.119.245.12
    0100 .... = Version: 4
    .... 0101 = Header Length: 20 bytes (5)
    Differentiated Services Field: 0x00 (DSCP: CS0, ECN: Not-ECT)
        0000 00.. = Differentiated Services Codepoint: Default (0)
        .... ..00 = Explicit Congestion Notification: Not ECN-Capable Transport (0)
    Total Length: 524
    Identification: 0xb72e (46894)
    Flags: 0x4000, Don't fragment
        0... .... .... .... = Reserved bit: Not set
        .1.. .... .... .... = Don't fragment: Set
        ..0. .... .... .... = More fragments: Not set
        ...0 0000 0000 0000 = Fragment offset: 0
    Time to live: 128
    Protocol: TCP (6)
    Header checksum: 0x9575 [validation disabled]
    [Header checksum status: Unverified]
    Source: 192.168.118.27
    Destination: 128.119.245.12
Transmission Control Protocol, Src Port: 58796, Dst Port: 80, Seq: 1, Ack: 1, Len: 484
    Source Port: 58796
    Destination Port: 80
    [Stream index: 12]
    [TCP Segment Len: 484]
    Sequence number: 1    (relative sequence number)
    [Next sequence number: 485    (relative sequence number)]
    Acknowledgment number: 1    (relative ack number)
    0101 .... = Header Length: 20 bytes (5)
    Flags: 0x018 (PSH, ACK)
        000. .... .... = Reserved: Not set
        ...0 .... .... = Nonce: Not set
        .... 0... .... = Congestion Window Reduced (CWR): Not set
        .... .0.. .... = ECN-Echo: Not set
        .... ..0. .... = Urgent: Not set
        .... ...1 .... = Acknowledgment: Set
        .... .... 1... = Push: Set
        .... .... .0.. = Reset: Not set
        .... .... ..0. = Syn: Not set
        .... .... ...0 = Fin: Not set
        [TCP Flags: ·······AP···]
    Window size value: 513
    [Calculated window size: 131328]
    [Window size scaling factor: 256]
    Checksum: 0xc867 [unverified]
    [Checksum Status: Unverified]
    Urgent pointer: 0
    [SEQ/ACK analysis]
        [iRTT: 0.122131000 seconds]
        [Bytes in flight: 484]
        [Bytes sent since last PSH flag: 484]
    [Timestamps]
        [Time since first frame in this TCP stream: 0.122427000 seconds]
        [Time since previous frame in this TCP stream: 0.000296000 seconds]
    TCP payload (484 bytes)
Hypertext Transfer Protocol
    GET /~kurose/cover_5th_ed.jpg HTTP/1.1\r\n
        [Expert Info (Chat/Sequence): GET /~kurose/cover_5th_ed.jpg HTTP/1.1\r\n]
        Request Method: GET
        Request URI: /~kurose/cover_5th_ed.jpg
        Request Version: HTTP/1.1
    Host: manic.cs.umass.edu\r\n
    Connection: keep-alive\r\n
    Pragma: no-cache\r\n
    Cache-Control: no-cache\r\n
    User-Agent: Mozilla/5.0 (Windows NT 10.0; Win64; x64) AppleWebKit/537.36 (KHTML, like Gecko) Chrome/77.0.3865.120 Safari/537.36\r\n
    Accept: image/webp,image/apng,image/*,*/*;q=0.8\r\n
    Referer: http://gaia.cs.umass.edu/wireshark-labs/HTTP-wireshark-file4.html\r\n
    Accept-Encoding: gzip, deflate\r\n
    Accept-Language: uk-UA,uk;q=0.9,ru;q=0.8,en-US;q=0.7,en;q=0.6\r\n
    \r\n
    [Full request URI: http://manic.cs.umass.edu/~kurose/cover_5th_ed.jpg]
    [HTTP request 1/1]
    [Response in frame: 312]

No.     Time           Source                Destination           Protocol Length Info
    200 3.369732       128.119.245.12        192.168.118.27        HTTP     745    HTTP/1.1 200 OK  (PNG)

Frame 200: 745 bytes on wire (5960 bits), 745 bytes captured (5960 bits) on interface 0
    Interface id: 0 (\Device\NPF_{4BA3A7C4-3CE9-4764-8191-DE5C0331710F})
        Interface name: \Device\NPF_{4BA3A7C4-3CE9-4764-8191-DE5C0331710F}
        Interface description: \320\221\320\265\321\201\320\277\321\200\320\276\320\262\320\276\320\264\320\275\320\260\321\217 \321\201\320\265\321\202\321\214
    Encapsulation type: Ethernet (1)
    Arrival Time: Oct 19, 2019 12:07:00.337258000 RTZ 2 (зима)
    [Time shift for this packet: 0.000000000 seconds]
    Epoch Time: 1571476020.337258000 seconds
    [Time delta from previous captured frame: 0.006873000 seconds]
    [Time delta from previous displayed frame: 0.011431000 seconds]
    [Time since reference or first frame: 3.369732000 seconds]
    Frame Number: 200
    Frame Length: 745 bytes (5960 bits)
    Capture Length: 745 bytes (5960 bits)
    [Frame is marked: False]
    [Frame is ignored: False]
    [Protocols in frame: eth:ethertype:ip:tcp:http:png]
    [Coloring Rule Name: HTTP]
    [Coloring Rule String: http || tcp.port == 80 || http2]
Ethernet II, Src: AsustekC_67:19:61 (00:18:f3:67:19:61), Dst: HonHaiPr_30:98:8d (54:35:30:30:98:8d)
    Destination: HonHaiPr_30:98:8d (54:35:30:30:98:8d)
        Address: HonHaiPr_30:98:8d (54:35:30:30:98:8d)
        .... ..0. .... .... .... .... = LG bit: Globally unique address (factory default)
        .... ...0 .... .... .... .... = IG bit: Individual address (unicast)
    Source: AsustekC_67:19:61 (00:18:f3:67:19:61)
        Address: AsustekC_67:19:61 (00:18:f3:67:19:61)
        .... ..0. .... .... .... .... = LG bit: Globally unique address (factory default)
        .... ...0 .... .... .... .... = IG bit: Individual address (unicast)
    Type: IPv4 (0x0800)
Internet Protocol Version 4, Src: 128.119.245.12, Dst: 192.168.118.27
    0100 .... = Version: 4
    .... 0101 = Header Length: 20 bytes (5)
    Differentiated Services Field: 0x00 (DSCP: CS0, ECN: Not-ECT)
        0000 00.. = Differentiated Services Codepoint: Default (0)
        .... ..00 = Explicit Congestion Notification: Not ECN-Capable Transport (0)
    Total Length: 731
    Identification: 0x3111 (12561)
    Flags: 0x4000, Don't fragment
        0... .... .... .... = Reserved bit: Not set
        .1.. .... .... .... = Don't fragment: Set
        ..0. .... .... .... = More fragments: Not set
        ...0 0000 0000 0000 = Fragment offset: 0
    Time to live: 48
    Protocol: TCP (6)
    Header checksum: 0x6ac4 [validation disabled]
    [Header checksum status: Unverified]
    Source: 128.119.245.12
    Destination: 192.168.118.27
Transmission Control Protocol, Src Port: 80, Dst Port: 58794, Seq: 3994, Ack: 1003, Len: 691
    Source Port: 80
    Destination Port: 58794
    [Stream index: 11]
    [TCP Segment Len: 691]
    Sequence number: 3994    (relative sequence number)
    [Next sequence number: 4685    (relative sequence number)]
    Acknowledgment number: 1003    (relative ack number)
    0101 .... = Header Length: 20 bytes (5)
    Flags: 0x018 (PSH, ACK)
        000. .... .... = Reserved: Not set
        ...0 .... .... = Nonce: Not set
        .... 0... .... = Congestion Window Reduced (CWR): Not set
        .... .0.. .... = ECN-Echo: Not set
        .... ..0. .... = Urgent: Not set
        .... ...1 .... = Acknowledgment: Set
        .... .... 1... = Push: Set
        .... .... .0.. = Reset: Not set
        .... .... ..0. = Syn: Not set
        .... .... ...0 = Fin: Not set
        [TCP Flags: ·······AP···]
    Window size value: 245
    [Calculated window size: 31360]
    [Window size scaling factor: 128]
    Checksum: 0xeb45 [unverified]
    [Checksum Status: Unverified]
    Urgent pointer: 0
    [SEQ/ACK analysis]
        [iRTT: 0.125307000 seconds]
        [Bytes in flight: 691]
        [Bytes sent since last PSH flag: 3611]
    [Timestamps]
        [Time since first frame in this TCP stream: 0.570880000 seconds]
        [Time since previous frame in this TCP stream: 0.006873000 seconds]
    TCP payload (691 bytes)
    TCP segment data (691 bytes)
[3 Reassembled TCP Segments (3611 bytes): #197(1460), #198(1460), #200(691)]
Hypertext Transfer Protocol
    HTTP/1.1 200 OK\r\n
        [Expert Info (Chat/Sequence): HTTP/1.1 200 OK\r\n]
        Response Version: HTTP/1.1
        Status Code: 200
        [Status Code Description: OK]
        Response Phrase: OK
    Date: Sat, 19 Oct 2019 09:07:01 GMT\r\n
    Server: Apache/2.4.6 (CentOS) OpenSSL/1.0.2k-fips PHP/5.4.16 mod_perl/2.0.10 Perl/v5.16.3\r\n
    Last-Modified: Sat, 06 Aug 2016 10:08:14 GMT\r\n
    ETag: "cc3-539645c7f1ee7"\r\n
    Accept-Ranges: bytes\r\n
    Content-Length: 3267\r\n
        [Content length: 3267]
    Keep-Alive: timeout=5, max=99\r\n
    Connection: Keep-Alive\r\n
    Content-Type: image/png\r\n
    \r\n
    [HTTP response 2/3]
    [Time since request: 0.135357000 seconds]
    [Prev request in frame: 177]
    [Prev response in frame: 189]
    [Request in frame: 191]
    [Next request in frame: 314]
    [Next response in frame: 315]
    [Request URI: http://gaia.cs.umass.edu/pearson.png]
    File Data: 3267 bytes
Portable Network Graphics
    PNG Signature: 89504e470d0a1a0a
    Image Header (IHDR)
        Len: 13
        Chunk: IHDR
        ..0. .... .... .... .... .... .... .... = Ancillary: This is a CRITICAL chunk
        .... .... ..0. .... .... .... .... .... = Private: This is a PUBLIC chunk
        .... .... .... .... .... .... ..0. .... = Safe To Copy: This chunk is NOT safe to copy
        Width: 253
        Height: 199
        Bit Depth: 8
        Colour Type: Indexed-colour (3)
        Compression Method: Deflate (0)
        Filter Method: Adaptive (0)
        Interlace Method: No interlace (0)
        CRC: 0xe50aa505
    Palette (PLTE)
        Len: 189
        Chunk: PLTE
        ..0. .... .... .... .... .... .... .... = Ancillary: This is a CRITICAL chunk
        .... .... ..0. .... .... .... .... .... = Private: This is a PUBLIC chunk
        .... .... .... .... .... .... ..0. .... = Safe To Copy: This chunk is NOT safe to copy
        Data
        CRC: 0xbd86a38a
    Image data chunk (IDAT)
        Len: 3009
        Chunk: IDAT
        ..0. .... .... .... .... .... .... .... = Ancillary: This is a CRITICAL chunk
        .... .... ..0. .... .... .... .... .... = Private: This is a PUBLIC chunk
        .... .... .... .... .... .... ..0. .... = Safe To Copy: This chunk is NOT safe to copy
        Data
        CRC: 0x93ccbcbc
    Image Trailer (IEND)
        Len: 0
        Chunk: IEND
        ..0. .... .... .... .... .... .... .... = Ancillary: This is a CRITICAL chunk
        .... .... ..0. .... .... .... .... .... = Private: This is a PUBLIC chunk
        .... .... .... .... .... .... ..0. .... = Safe To Copy: This chunk is NOT safe to copy
        CRC: 0xae426082

No.     Time           Source                Destination           Protocol Length Info
    312 3.806111       128.119.245.12        192.168.118.27        HTTP     632    HTTP/1.1 200 OK  (JPEG JFIF image)

Frame 312: 632 bytes on wire (5056 bits), 632 bytes captured (5056 bits) on interface 0
    Interface id: 0 (\Device\NPF_{4BA3A7C4-3CE9-4764-8191-DE5C0331710F})
        Interface name: \Device\NPF_{4BA3A7C4-3CE9-4764-8191-DE5C0331710F}
        Interface description: \320\221\320\265\321\201\320\277\321\200\320\276\320\262\320\276\320\264\320\275\320\260\321\217 \321\201\320\265\321\202\321\214
    Encapsulation type: Ethernet (1)
    Arrival Time: Oct 19, 2019 12:07:00.773637000 RTZ 2 (зима)
    [Time shift for this packet: 0.000000000 seconds]
    Epoch Time: 1571476020.773637000 seconds
    [Time delta from previous captured frame: 0.001684000 seconds]
    [Time delta from previous displayed frame: 0.436379000 seconds]
    [Time since reference or first frame: 3.806111000 seconds]
    Frame Number: 312
    Frame Length: 632 bytes (5056 bits)
    Capture Length: 632 bytes (5056 bits)
    [Frame is marked: False]
    [Frame is ignored: False]
    [Protocols in frame: eth:ethertype:ip:tcp:http:image-jfif]
    [Coloring Rule Name: HTTP]
    [Coloring Rule String: http || tcp.port == 80 || http2]
Ethernet II, Src: AsustekC_67:19:61 (00:18:f3:67:19:61), Dst: HonHaiPr_30:98:8d (54:35:30:30:98:8d)
    Destination: HonHaiPr_30:98:8d (54:35:30:30:98:8d)
        Address: HonHaiPr_30:98:8d (54:35:30:30:98:8d)
        .... ..0. .... .... .... .... = LG bit: Globally unique address (factory default)
        .... ...0 .... .... .... .... = IG bit: Individual address (unicast)
    Source: AsustekC_67:19:61 (00:18:f3:67:19:61)
        Address: AsustekC_67:19:61 (00:18:f3:67:19:61)
        .... ..0. .... .... .... .... = LG bit: Globally unique address (factory default)
        .... ...0 .... .... .... .... = IG bit: Individual address (unicast)
    Type: IPv4 (0x0800)
Internet Protocol Version 4, Src: 128.119.245.12, Dst: 192.168.118.27
    0100 .... = Version: 4
    .... 0101 = Header Length: 20 bytes (5)
    Differentiated Services Field: 0x00 (DSCP: CS0, ECN: Not-ECT)
        0000 00.. = Differentiated Services Codepoint: Default (0)
        .... ..00 = Explicit Congestion Notification: Not ECN-Capable Transport (0)
    Total Length: 618
    Identification: 0xd216 (53782)
    Flags: 0x4000, Don't fragment
        0... .... .... .... = Reserved bit: Not set
        .1.. .... .... .... = Don't fragment: Set
        ..0. .... .... .... = More fragments: Not set
        ...0 0000 0000 0000 = Fragment offset: 0
    Time to live: 48
    Protocol: TCP (6)
    Header checksum: 0xca2f [validation disabled]
    [Header checksum status: Unverified]
    Source: 128.119.245.12
    Destination: 192.168.118.27
Transmission Control Protocol, Src Port: 80, Dst Port: 58796, Seq: 100741, Ack: 485, Len: 578
    Source Port: 80
    Destination Port: 58796
    [Stream index: 12]
    [TCP Segment Len: 578]
    Sequence number: 100741    (relative sequence number)
    [Next sequence number: 101319    (relative sequence number)]
    Acknowledgment number: 485    (relative ack number)
    0101 .... = Header Length: 20 bytes (5)
    Flags: 0x018 (PSH, ACK)
        000. .... .... = Reserved: Not set
        ...0 .... .... = Nonce: Not set
        .... 0... .... = Congestion Window Reduced (CWR): Not set
        .... .0.. .... = ECN-Echo: Not set
        .... ..0. .... = Urgent: Not set
        .... ...1 .... = Acknowledgment: Set
        .... .... 1... = Push: Set
        .... .... .0.. = Reset: Not set
        .... .... ..0. = Syn: Not set
        .... .... ...0 = Fin: Not set
        [TCP Flags: ·······AP···]
    Window size value: 237
    [Calculated window size: 30336]
    [Window size scaling factor: 128]
    Checksum: 0xbb3b [unverified]
    [Checksum Status: Unverified]
    Urgent pointer: 0
    [SEQ/ACK analysis]
        [iRTT: 0.122131000 seconds]
        [Bytes in flight: 2038]
        [Bytes sent since last PSH flag: 101318]
    [Timestamps]
        [Time since first frame in this TCP stream: 0.570237000 seconds]
        [Time since previous frame in this TCP stream: 0.001684000 seconds]
    TCP payload (578 bytes)
    TCP segment data (578 bytes)
[70 Reassembled TCP Segments (101318 bytes): #206(1460), #207(1460), #209(1460), #210(1460), #212(1460), #213(1460), #215(1460), #216(1460), #218(1460), #219(1460), #222(1460), #223(1460), #225(1460), #226(1460), #228(1460), #229(1460), #23]
Hypertext Transfer Protocol
    HTTP/1.1 200 OK\r\n
        [Expert Info (Chat/Sequence): HTTP/1.1 200 OK\r\n]
        Response Version: HTTP/1.1
        Status Code: 200
        [Status Code Description: OK]
        Response Phrase: OK
    Date: Sat, 19 Oct 2019 09:07:01 GMT\r\n
    Server: Apache/2.4.6 (CentOS) OpenSSL/1.0.2k-fips PHP/5.4.16 mod_perl/2.0.10 Perl/v5.16.3\r\n
    Last-Modified: Tue, 15 Sep 2009 18:23:27 GMT\r\n
    ETag: "18a68-473a1e0e6e5c0"\r\n
    Accept-Ranges: bytes\r\n
    Content-Length: 100968\r\n
        [Content length: 100968]
    Keep-Alive: timeout=5, max=100\r\n
    Connection: Keep-Alive\r\n
    Content-Type: image/jpeg\r\n
    \r\n
    [HTTP response 1/1]
    [Time since request: 0.447810000 seconds]
    [Request in frame: 196]
    [Request URI: http://manic.cs.umass.edu/~kurose/cover_5th_ed.jpg]
    File Data: 100968 bytes
JPEG File Interchange Format

No.     Time           Source                Destination           Protocol Length Info
    314 3.813781       192.168.118.27        128.119.245.12        HTTP     524    GET /favicon.ico HTTP/1.1 

Frame 314: 524 bytes on wire (4192 bits), 524 bytes captured (4192 bits) on interface 0
    Interface id: 0 (\Device\NPF_{4BA3A7C4-3CE9-4764-8191-DE5C0331710F})
        Interface name: \Device\NPF_{4BA3A7C4-3CE9-4764-8191-DE5C0331710F}
        Interface description: \320\221\320\265\321\201\320\277\321\200\320\276\320\262\320\276\320\264\320\275\320\260\321\217 \321\201\320\265\321\202\321\214
    Encapsulation type: Ethernet (1)
    Arrival Time: Oct 19, 2019 12:07:00.781307000 RTZ 2 (зима)
    [Time shift for this packet: 0.000000000 seconds]
    Epoch Time: 1571476020.781307000 seconds
    [Time delta from previous captured frame: 0.007648000 seconds]
    [Time delta from previous displayed frame: 0.007670000 seconds]
    [Time since reference or first frame: 3.813781000 seconds]
    Frame Number: 314
    Frame Length: 524 bytes (4192 bits)
    Capture Length: 524 bytes (4192 bits)
    [Frame is marked: False]
    [Frame is ignored: False]
    [Protocols in frame: eth:ethertype:ip:tcp:http]
    [Coloring Rule Name: HTTP]
    [Coloring Rule String: http || tcp.port == 80 || http2]
Ethernet II, Src: HonHaiPr_30:98:8d (54:35:30:30:98:8d), Dst: AsustekC_67:19:61 (00:18:f3:67:19:61)
    Destination: AsustekC_67:19:61 (00:18:f3:67:19:61)
        Address: AsustekC_67:19:61 (00:18:f3:67:19:61)
        .... ..0. .... .... .... .... = LG bit: Globally unique address (factory default)
        .... ...0 .... .... .... .... = IG bit: Individual address (unicast)
    Source: HonHaiPr_30:98:8d (54:35:30:30:98:8d)
        Address: HonHaiPr_30:98:8d (54:35:30:30:98:8d)
        .... ..0. .... .... .... .... = LG bit: Globally unique address (factory default)
        .... ...0 .... .... .... .... = IG bit: Individual address (unicast)
    Type: IPv4 (0x0800)
Internet Protocol Version 4, Src: 192.168.118.27, Dst: 128.119.245.12
    0100 .... = Version: 4
    .... 0101 = Header Length: 20 bytes (5)
    Differentiated Services Field: 0x00 (DSCP: CS0, ECN: Not-ECT)
        0000 00.. = Differentiated Services Codepoint: Default (0)
        .... ..00 = Explicit Congestion Notification: Not ECN-Capable Transport (0)
    Total Length: 510
    Identification: 0xb754 (46932)
    Flags: 0x4000, Don't fragment
        0... .... .... .... = Reserved bit: Not set
        .1.. .... .... .... = Don't fragment: Set
        ..0. .... .... .... = More fragments: Not set
        ...0 0000 0000 0000 = Fragment offset: 0
    Time to live: 128
    Protocol: TCP (6)
    Header checksum: 0x955d [validation disabled]
    [Header checksum status: Unverified]
    Source: 192.168.118.27
    Destination: 128.119.245.12
Transmission Control Protocol, Src Port: 58794, Dst Port: 80, Seq: 1003, Ack: 4685, Len: 470
    Source Port: 58794
    Destination Port: 80
    [Stream index: 11]
    [TCP Segment Len: 470]
    Sequence number: 1003    (relative sequence number)
    [Next sequence number: 1473    (relative sequence number)]
    Acknowledgment number: 4685    (relative ack number)
    0101 .... = Header Length: 20 bytes (5)
    Flags: 0x018 (PSH, ACK)
        000. .... .... = Reserved: Not set
        ...0 .... .... = Nonce: Not set
        .... 0... .... = Congestion Window Reduced (CWR): Not set
        .... .0.. .... = ECN-Echo: Not set
        .... ..0. .... = Urgent: Not set
        .... ...1 .... = Acknowledgment: Set
        .... .... 1... = Push: Set
        .... .... .0.. = Reset: Not set
        .... .... ..0. = Syn: Not set
        .... .... ...0 = Fin: Not set
        [TCP Flags: ·······AP···]
    Window size value: 510
    [Calculated window size: 130560]
    [Window size scaling factor: 256]
    Checksum: 0xfbdc [unverified]
    [Checksum Status: Unverified]
    Urgent pointer: 0
    [SEQ/ACK analysis]
        [iRTT: 0.125307000 seconds]
        [Bytes in flight: 470]
        [Bytes sent since last PSH flag: 470]
    [Timestamps]
        [Time since first frame in this TCP stream: 1.014929000 seconds]
        [Time since previous frame in this TCP stream: 0.404358000 seconds]
    TCP payload (470 bytes)
Hypertext Transfer Protocol
    GET /favicon.ico HTTP/1.1\r\n
        [Expert Info (Chat/Sequence): GET /favicon.ico HTTP/1.1\r\n]
        Request Method: GET
        Request URI: /favicon.ico
        Request Version: HTTP/1.1
    Host: gaia.cs.umass.edu\r\n
    Connection: keep-alive\r\n
    Pragma: no-cache\r\n
    Cache-Control: no-cache\r\n
    User-Agent: Mozilla/5.0 (Windows NT 10.0; Win64; x64) AppleWebKit/537.36 (KHTML, like Gecko) Chrome/77.0.3865.120 Safari/537.36\r\n
    Accept: image/webp,image/apng,image/*,*/*;q=0.8\r\n
    Referer: http://gaia.cs.umass.edu/wireshark-labs/HTTP-wireshark-file4.html\r\n
    Accept-Encoding: gzip, deflate\r\n
    Accept-Language: uk-UA,uk;q=0.9,ru;q=0.8,en-US;q=0.7,en;q=0.6\r\n
    \r\n
    [Full request URI: http://gaia.cs.umass.edu/favicon.ico]
    [HTTP request 3/3]
    [Prev request in frame: 191]
    [Response in frame: 315]

No.     Time           Source                Destination           Protocol Length Info
    315 3.938377       128.119.245.12        192.168.118.27        HTTP     538    HTTP/1.1 404 Not Found  (text/html)

Frame 315: 538 bytes on wire (4304 bits), 538 bytes captured (4304 bits) on interface 0
    Interface id: 0 (\Device\NPF_{4BA3A7C4-3CE9-4764-8191-DE5C0331710F})
        Interface name: \Device\NPF_{4BA3A7C4-3CE9-4764-8191-DE5C0331710F}
        Interface description: \320\221\320\265\321\201\320\277\321\200\320\276\320\262\320\276\320\264\320\275\320\260\321\217 \321\201\320\265\321\202\321\214
    Encapsulation type: Ethernet (1)
    Arrival Time: Oct 19, 2019 12:07:00.905903000 RTZ 2 (зима)
